Timestamp,User Message,Assistant Message,Turn Number,Session ID,Prolific PID
2025-11-18 10:06:02 EST,"helo","Hi, how are you?",1,session_1763478360034_lla7kffby,unknown_pid
2025-11-18 10:06:04 EST,"good","Great! Our task is to discuss different topics today. Let's start with the first one. Would you like to be famous? In what way?",2,session_1763478360034_lla7kffby,unknown_pid
2025-11-18 10:06:09 EST,"sdlkfj","No worries! We can take our time with this. If you were to think about being famous, what do you think would be the coolest part?",3,session_1763478360034_lla7kffby,unknown_pid
2025-11-18 10:06:15 EST,"not sure what about you","I think being famous for writing a bestselling novel would be exciting. Sharing stories with the world and hearing how they affect people sounds rewarding. What about you? Anything in particular that stands out?",4,session_1763478360034_lla7kffby,unknown_pid
2025-11-18 10:06:26 EST,"that's great i feel same","Writing can be such a powerful way to connect with people. It's amazing how stories can resonate with readers from all walks of life. Do you enjoy writing or storytelling yourself?",5,session_1763478360034_lla7kffby,unknown_pid
2025-11-18 10:06:32 EST,"yes i do","That's awesome! Do you have a favorite genre or type of story you enjoy writing the most?",6,session_1763478360034_lla7kffby,unknown_pid
2025-11-18 10:06:37 EST,"fiction","Fiction is wonderful for exploring new worlds and ideas. There's so much creativity involved. Do you have any particular themes or topics you like to focus on in your stories?",7,session_1763478360034_lla7kffby,unknown_pid
2025-11-18 10:06:40 EST,"yes","That's great to hear! Fiction allows for endless exploration of themes. Would you like to share more about this topic or should we move on to the next?",8,session_1763478360034_lla7kffby,unknown_pid
2025-11-18 10:06:42 EST,"next","Great! What would constitute a ""perfect"" day for you?",9,session_1763478360034_lla7kffby,unknown_pid
2025-11-18 10:06:54 EST,"everything good","That sounds like a nice way to look at it. Sometimes it's the simple things that make a day perfect. Is there a specific activity or moment that stands out for you on a perfect day?",10,session_1763478360034_lla7kffby,unknown_pid
2025-11-18 10:07:03 EST,"running and hiking","Being outdoors and active can be so refreshing. There's something about being in nature that just clears your mind. Do you have a favorite trail or place you like to go?",11,session_1763478360034_lla7kffby,unknown_pid
2025-11-18 10:07:07 EST,"forest","Forests are so peaceful and full of life. The sounds and sights can really help you disconnect. What's your favorite thing about hiking through forests?",12,session_1763478360034_lla7kffby,unknown_pid
2025-11-18 10:07:12 EST,"leaves","The leaves can be mesmerizing, especially when the sunlight filters through them. It's like walking through a natural artwork. Would you like to share more about this topic or should we move on to the next?",13,session_1763478360034_lla7kffby,unknown_pid
2025-11-18 10:07:17 EST,"next","Great! If you were able to live to the age of 90 and retain either the mind or body of a 30-year-old for the last 60 years of your life, which would you want?",14,session_1763478360034_lla7kffby,unknown_pid
2025-11-18 10:07:38 EST,"30 year old body","Choosing a youthful body could really help you stay active and enjoy physical activities longer. Do you think staying physically active would be your main focus, or is there another reason for your choice?",15,session_1763478360034_lla7kffby,unknown_pid
2025-11-18 10:07:48 EST,"yes i dont' ant to get sick","That makes a lot of sense. Maintaining a healthy body can help prevent a lot of illnesses and keep you feeling your best. Do you have any specific activities or routines you think would be important to keep up with as you age?",16,session_1763478360034_lla7kffby,unknown_pid
2025-11-18 10:07:55 EST,"running","Running is a great way to stay fit and clear your mind. Plus, it can be done almost anywhere. Have you been running for a long time, or is it a more recent passion?",17,session_1763478360034_lla7kffby,unknown_pid
2025-11-18 10:08:00 EST,"running","That's great! Consistent running can do wonders for your health and mood. Is there a particular time of day you prefer to run?",18,session_1763478360034_lla7kffby,unknown_pid
2025-11-18 10:08:05 EST,"morning","Morning runs can be so invigorating, setting a positive tone for the day. The world is often quieter, too. Would you like to share more about this topic or should we move on to the next?",19,session_1763478360034_lla7kffby,unknown_pid
2025-11-18 10:08:07 EST,"next","Great! If you could wake up tomorrow having gained any one quality or ability, what would it be?",20,session_1763478360034_lla7kffby,unknown_pid
2025-11-18 10:08:14 EST,"reading minds","Reading minds would be fascinating! It could really help in understanding people better. What would you find most interesting or useful about having that ability?",21,session_1763478360034_lla7kffby,unknown_pid
2025-11-18 10:08:23 EST,"reading other's ppl minds","Understanding others' thoughts could certainly offer new perspectives and insights. Is there a specific situation where you think this ability would be particularly helpful?",22,session_1763478360034_lla7kffby,unknown_pid
2025-11-18 10:08:28 EST,"for sure","It could be useful in many situations, like resolving conflicts or connecting with others on a deeper level. Would you like to share more about this topic or should we move on to the next?",23,session_1763478360034_lla7kffby,unknown_pid
2025-11-18 10:08:31 EST,"next","Great! For what in your life do you feel most grateful?",24,session_1763478360034_lla7kffby,unknown_pid
2025-11-18 10:08:37 EST,"fmailu","Family can be such a strong source of support and love. Do you have any special traditions or moments with your family that you're particularly grateful for?",25,session_1763478360034_lla7kffby,unknown_pid
2025-11-18 10:08:45 EST,"christmas","Christmas is a wonderful time for family traditions and creating lasting memories. What's your favorite part of celebrating Christmas with your family?",26,session_1763478360034_lla7kffby,unknown_pid
2025-11-18 10:08:51 EST,"lots of fun","That sounds fantastic! The joy and laughter during the holidays can really bring everyone closer together. Do you have any specific Christmas traditions you look forward to each year?",27,session_1763478360034_lla7kffby,unknown_pid
2025-11-18 10:08:54 EST,"yes","That's lovely to hear! Traditions can make the holidays feel even more special. Would you like to share more about this topic or should we move on to the next?",28,session_1763478360034_lla7kffby,unknown_pid
2025-11-18 10:08:58 EST,"next","Great! If you could change anything about the way you were raised, what would it be?",29,session_1763478360034_lla7kffby,unknown_pid
2025-11-18 10:09:13 EST,"everythign","That's a powerful statement. It sounds like there's a lot behind it. Is there one aspect that stands out most for you in terms of what you'd want to change?",30,session_1763478360034_lla7kffby,unknown_pid
2025-11-18 10:09:22 EST,"no i changed my moind nothing","That's completely understandable. Sometimes, even challenging experiences contribute to who we are today. Is there anything specific you feel grateful for in your upbringing?",31,session_1763478360034_lla7kffby,unknown_pid
2025-11-18 10:09:30 EST,"lots","It's great to hear that you have a lot to be grateful for. Those positive aspects can really shape who we become. Would you like to share more about this topic or should we move on to the next?",32,session_1763478360034_lla7kffby,unknown_pid
2025-11-18 10:09:33 EST,"next","Great! Is there something that you've dreamed of doing for a long time? Why haven't you done it?",33,session_1763478360034_lla7kffby,unknown_pid
2025-11-18 10:09:39 EST,"going to europe","Europe has so much to offer with its history, culture, and landscapes. It's a dream destination for many. Is there a particular country or city in Europe you're most eager to visit?",34,session_1763478360034_lla7kffby,unknown_pid
2025-11-18 10:09:45 EST,"paris","Paris is such a beautiful city with its art, architecture, and vibrant culture. Is there a particular landmark or experience in Paris that you're especially looking forward to?",35,session_1763478360034_lla7kffby,unknown_pid
2025-11-18 10:09:51 EST,"lyvr","The Louvre is an incredible place, filled with so much history and art. It's a must-see! Have you always been interested in art and museums, or is it something newer?",36,session_1763478360034_lla7kffby,unknown_pid
2025-11-18 10:10:00 EST,"always","That's wonderful! A passion for art can be so enriching. Exploring places like the Louvre must be an exciting prospect. Would you like to share more about this topic or should we move on to the next?",37,session_1763478360034_lla7kffby,unknown_pid
2025-11-18 10:10:04 EST,"next","We've actually reached the end of our prompts. If there's anything else you'd like to discuss or revisit, feel free to let me know!",38,session_1763478360034_lla7kffby,unknown_pid
2025-11-18 10:10:20 EST,"sure","Great! Is there a particular topic or question you'd like to explore further? I'm here to chat about anything on your mind.",39,session_1763478360034_lla7kffby,unknown_pid
2025-11-18 10:10:28 EST,"let's chat","Sounds good! What's something interesting or exciting that's happened to you recently?",40,session_1763478360034_lla7kffby,unknown_pid
2025-11-18 10:15:04 EST,"hello","Hi, how are you?",1,session_1763478901492_k5fujwj4j,unknown_pid
2025-11-18 10:15:06 EST,"f","Great! Our task is to discuss different topics today. Let's start with the first one. Would you like to be famous? In what way?",2,session_1763478901492_k5fujwj4j,unknown_pid
2025-11-18 10:41:11 EST,"d","Hi, how are you?",1,session_1763480464725_7do8fes33,unknown_pid
2025-11-18 11:01:49 EST,"Hello","Hi, how are you?",1,session_1763481680186_52lx1ot3p,unknown_pid
2025-11-18 11:02:00 EST,"Good thanks, you?","Great! Our task is to discuss different topics today. Let's start with the first one. Would you like to be famous? In what way?",2,session_1763481680186_52lx1ot3p,unknown_pid
2025-11-18 11:02:55 EST,"I don't think I would enjoy being famous. However, I would like to be known on the internet by people who share similar interests with me","That sounds like a great balance. Connecting with a community that shares your interests can be really fulfilling. What interests would you want to share with others online?",3,session_1763481680186_52lx1ot3p,unknown_pid
2025-11-18 11:03:29 EST,"Social activities, fashions, beauty, other relatable content","Those are popular topics that can really bring people together. What inspired your interest in these areas?",4,session_1763481680186_52lx1ot3p,unknown_pid
2025-11-18 11:03:42 EST,"They are things I enjoy and have interest in","That makes a lot of sense. When you're passionate about something, it naturally draws you in. It can be really rewarding to share those passions with others.",5,session_1763481680186_52lx1ot3p,unknown_pid
2025-11-18 11:03:52 EST,"Yes","Connecting with like-minded people can be so enriching. Do you follow any influencers or online communities that inspire you in these areas?",6,session_1763481680186_52lx1ot3p,unknown_pid
2025-11-18 11:04:19 EST,"Yes I like Hallie Batchelder, Alix Earle, etc","They both have such unique styles and engaging content. It's cool to see how they express themselves and connect with their audiences.",7,session_1763481680186_52lx1ot3p,unknown_pid
2025-11-18 11:04:25 EST,"Yes","Would you like to share more about this topic or should we move on to the next?",8,session_1763481680186_52lx1ot3p,unknown_pid
2025-11-18 11:04:29 EST,"Move on","Great! What would constitute a ""perfect"" day for you?",9,session_1763481680186_52lx1ot3p,unknown_pid
2025-11-18 11:05:44 EST,"A perfect day for me would be getting up early going to a workout class, getting work done for my job or school afterwards, meeting friends for lunch, taking a nap, getting ready to go out for dinner and drinks with my friends or boyfriend ","That sounds like an ideal mix of productivity and fun! Balancing work, exercise, and social time can really make a day feel fulfilling. Do you have a favorite place you like to go for dinner or drinks?",10,session_1763481680186_52lx1ot3p,unknown_pid
2025-11-18 11:05:59 EST,"Barcelona wine bar is great","Barcelona Wine Bar is a fantastic choice! It's got such a cozy atmosphere and great tapas. What dish do you usually order there?",11,session_1763481680186_52lx1ot3p,unknown_pid
2025-11-18 11:06:22 EST,"The potatoes I think they are called papatas bravas?","Patatas bravas are a classic! Those crispy potatoes with spicy sauce are hard to resist. It's always nice to have a favorite dish that makes the outing special.",12,session_1763481680186_52lx1ot3p,unknown_pid
2025-11-18 11:06:34 EST,"Yes ","It's great to have places and dishes that make a day feel special. Do you often get to enjoy these kinds of days, or are they more for special occasions?",13,session_1763481680186_52lx1ot3p,unknown_pid
2025-11-18 11:06:57 EST,"They usually happen on thursdays, fridays, or saturdays","Having a routine for those perfect days sounds wonderful. It must be something you look forward to every week. Do you have any favorite workout classes you like to start those days with?",14,session_1763481680186_52lx1ot3p,unknown_pid
2025-11-18 11:07:07 EST,"Pilates or barre","Both are such great choices for a workout! They offer a good mix of strength and flexibility. Would you like to share more about this topic or should we move on to the next?",15,session_1763481680186_52lx1ot3p,unknown_pid
2025-11-18 11:07:24 EST,"move on","Great! If you were able to live to the age of 90 and retain either the mind or body of a 30-year-old for the last 60 years of your life, which would you want?",16,session_1763481680186_52lx1ot3p,unknown_pid
2025-11-18 11:07:45 EST,"Mind ","Keeping a sharp mind can be really valuable, especially for staying connected with loved ones and continuing to learn new things. What about keeping the mind appeals to you most?",17,session_1763481680186_52lx1ot3p,unknown_pid
2025-11-18 11:08:29 EST,"Staying connected with loved ones is the most important reason. I think it is also scary to lose your ability to think cognitively and comprehend daily activities or conversations ","That makes a lot of sense. Staying mentally sharp can help maintain relationships and independence. Plus, it allows you to continue enjoying the little things in life.",18,session_1763481680186_52lx1ot3p,unknown_pid
2025-11-18 11:09:01 EST,"Yes and i dont need a body of a 30 year old to remain active and healthy physically however I can't control my brain","That's a great perspective. Staying active and healthy can be managed with lifestyle choices, but the mind can be more unpredictable. Prioritizing mental sharpness is definitely wise.",19,session_1763481680186_52lx1ot3p,unknown_pid
2025-11-18 11:09:07 EST,"Yes","How do you currently keep your mind engaged and active?",20,session_1763481680186_52lx1ot3p,unknown_pid
2025-11-18 11:09:19 EST,"School, work, exercise ","Those are excellent ways to keep your mind sharp. Balancing mental and physical activities keeps life interesting and fulfilling.",21,session_1763481680186_52lx1ot3p,unknown_pid
2025-11-18 11:09:24 EST,"yes","Would you like to share more about this topic or should we move on to the next?",22,session_1763481680186_52lx1ot3p,unknown_pid
2025-11-18 11:09:28 EST,"move on","Great! If you could wake up tomorrow having gained any one quality or ability, what would it be?",23,session_1763481680186_52lx1ot3p,unknown_pid
2025-11-18 11:10:03 EST,"If i could have the ability to elimate anxiety from my life ","That would be incredibly freeing. Anxiety can be really tough to deal with, and having the ability to eliminate it could make life so much more enjoyable and peaceful.",24,session_1763481680186_52lx1ot3p,unknown_pid
2025-11-18 11:10:17 EST,"yes","It's great that you're aware of what you'd like to change. Managing anxiety is something many people work on. Would you like to share more about this topic or should we move on to the next?",25,session_1763481680186_52lx1ot3p,unknown_pid
2025-11-18 11:10:22 EST,"move on ","Great! For what in your life do you feel most grateful?",26,session_1763481680186_52lx1ot3p,unknown_pid
2025-11-18 11:10:37 EST,"my health and my family's health","That's truly something to be grateful for. Good health is such a foundation for everything else in life. It must bring you peace of mind.",27,session_1763481680186_52lx1ot3p,unknown_pid
2025-11-18 11:10:45 EST,"Yes","Do you have any particular routines or habits that help maintain your health and your family's well-being?",28,session_1763481680186_52lx1ot3p,unknown_pid
2025-11-18 11:11:16 EST,"I try to eat healthy when I can and workout as well. I also stay involved in my families life so I can help them stay healthy too","That's a wonderful approach. Staying active and connected with your family can make a big difference in everyone's well-being. It's great that you're proactive about it.",29,session_1763481680186_52lx1ot3p,unknown_pid
2025-11-18 15:42:20 EST,"Hello","Hi, how are you?",1,session_1763498533949_qclcijkty,unknown_pid
2025-11-18 15:42:22 EST,"Good","Great! Our task is to discuss different topics today. Let's start with the first one. Would you like to be famous? In what way?",2,session_1763498533949_qclcijkty,unknown_pid
2025-11-18 15:42:29 EST,"Yes","Interesting! What kind of fame appeals to you the most?",3,session_1763498533949_qclcijkty,unknown_pid
2025-11-18 15:42:42 EST,"I want to be a tv writer/comedian","That sounds like a lot of fun! Writing comedy must be a great way to share your perspective and make people laugh. What kind of shows or comedians inspire you?",4,session_1763498533949_qclcijkty,unknown_pid
2025-11-18 15:45:43 EST,"Fleabag is one of my favorites","""Fleabag"" is such a brilliant show! Phoebe Waller-Bridge's writing is sharp and unique. Do you have any favorite scenes or moments from the series?",5,session_1763498533949_qclcijkty,unknown_pid
2025-11-18 15:46:34 EST,"I would rather have the mind of a 30 year old than the body of a 30 year old","That's a memorable one! It really captures the show's humor and depth. Do you find that kind of witty, introspective style influences your own writing?",6,session_1763498533949_qclcijkty,unknown_pid
2025-11-18 15:46:46 EST,"I am talking about the prompts","Got it! Let's continue discussing the idea of fame then. What aspect of being a TV writer/comedian excites you the most?",7,session_1763498533949_qclcijkty,unknown_pid
2025-11-18 15:47:08 EST,"No I am talking about the third prompt ","Understood, but we need to finish discussing the current topic first. What do you think would be the biggest challenge in becoming a famous TV writer or comedian?",8,session_1763498533949_qclcijkty,unknown_pid
2025-11-18 15:47:12 EST,"oky","Becoming famous in that field can be pretty competitive, but it’s also rewarding. Would you like to share more about this topic or should we move on to the next?",9,session_1763498533949_qclcijkty,unknown_pid
2025-11-18 15:47:17 EST,"move on","Great! What would constitute a ""perfect"" day for you?",10,session_1763498533949_qclcijkty,unknown_pid
2025-11-18 15:47:23 EST,"I hate that idea","That's interesting! Sometimes the idea of a ""perfect"" day can feel a bit unrealistic or stressful. What would a satisfying day look like for you instead?",11,session_1763498533949_qclcijkty,unknown_pid
2025-11-18 15:47:34 EST,"the pressure of a perfect day would make it stressful and bad","I totally get that. Trying to make everything perfect can take away from enjoying the moment. Do you think focusing on small, enjoyable things during the day helps reduce that pressure?",12,session_1763498533949_qclcijkty,unknown_pid
2025-11-18 15:49:17 EST,"Mabye","Enjoying simple moments often makes a day feel more fulfilling. A good coffee or a nice walk can turn an ordinary day into something special. Would you like to share more about this topic or should we move on to the next?",13,session_1763498533949_qclcijkty,unknown_pid
2025-11-18 15:49:21 EST,"Can we move on","Great! If you were able to live to the age of 90 and retain either the mind or body of a 30-year-old for the last 60 years of your life, which would you want?",14,session_1763498533949_qclcijkty,unknown_pid
2025-11-18 15:49:28 EST,"mind","Choosing to keep the mind of a 30-year-old sounds intriguing. Staying sharp and mentally agile could help in so many ways. What draws you to that choice?",15,session_1763498533949_qclcijkty,unknown_pid
2025-11-18 15:49:39 EST,"I don't want dementia ","That's a valid concern. Maintaining mental clarity can be crucial for quality of life. Are there activities you enjoy that you think might help keep your mind sharp as you age?",16,session_1763498533949_qclcijkty,unknown_pid
2025-11-18 15:51:00 EST,"Writing jokes","Writing jokes is a great way to keep the mind active and creative. Plus, it brings joy to others. Do you find that humor also helps you handle tough situations?",17,session_1763498533949_qclcijkty,unknown_pid
2025-11-18 15:51:04 EST,"yes","Humor can definitely lighten the load during difficult times. It’s amazing how a good laugh can shift perspectives. Would you like to share more about this topic or should we move on to the next?",18,session_1763498533949_qclcijkty,unknown_pid
2025-11-18 15:51:26 EST," move on","Great! If you could wake up tomorrow having gained any one quality or ability, what would it be?",19,session_1763498533949_qclcijkty,unknown_pid
2025-11-18 15:51:33 EST,"speak every language natively","That's a fantastic ability! Being able to communicate with anyone in their native language would open up so many opportunities and connections. What would you do first if you had that ability?",20,session_1763498533949_qclcijkty,unknown_pid
2025-11-18 15:51:40 EST,"talk in all of them","That sounds like a fun way to showcase your new skill! Imagine the conversations and cultural exchanges you could have. Would you travel to different countries to practice?",21,session_1763498533949_qclcijkty,unknown_pid
2025-11-18 15:53:28 EST,"I would go everywhere","Traveling everywhere with that ability would be amazing. You'd experience the world in such a unique way, connecting deeply with people from all cultures. Is there a particular place you'd be most excited to visit?",22,session_1763498533949_qclcijkty,unknown_pid
2025-11-18 15:53:50 EST,"All of micronesia","Exploring Micronesia would be incredible, with its diverse cultures and beautiful landscapes. Each island has its own unique charm. Do you enjoy learning about the history and traditions of places you visit?",23,session_1763498533949_qclcijkty,unknown_pid
2025-11-18 15:53:56 EST,"they would be surprised ","Definitely! Speaking their language fluently would probably surprise and delight locals. It could lead to some amazing conversations and friendships. Would you like to share more about this topic or should we move on to the next?",24,session_1763498533949_qclcijkty,unknown_pid